0,listening to - http://bit.ly/3rfG87  - and @gpk3 admits he is WHIPPED - lol - hell of a hum 
0,"Not watchin the England Kazak game, going to be boring like every other England game!! "
0,Needs a starbucks 
0,@tennischick38 That is so cool.. I want unlimited passes.. I was thrown in TJail 8 times yesterday &amp; some of them I wasn't even tweeting 
0,Goin to work.... 
0,"I am far from impressed with the weather today, i should be out having fun not stuck in watching it rain "
0,I have work in 50 minutes...leaving in about 20. Life sucks  Really don't feel well either 
0,@nmcgivney As for harbingers...them &amp; portents can sod off.  Each time I get smthng for the garden it rains for weeks. Got a tomato plant 
0,I wanna take a nap~~Zzzzzz~~My Last Day Here  :0
0,Kawasaki asplode. New motor time. 
0,working 8-3  and graduationnnn
0,This is taking way too long man jeez. I WANNA GO HOME 
0,"@MissMikkiMouse LMAO i hate that song too x_____x And yes, do write, do write, do write lol. I loved TCF5Y last night awww Chris "
0,loving you aint the same nomore. 
0,"@OfficialAkaye have a good one, I went four times, it was amazing. I'm sad it's not happening next year "
0,I have hungry... 
0,@Johnathonhock Hay gurl hay 
0,was plannin to shop 2day but gonna give it a miss  !!!
0,@ExtraordMommy Thank u 4 the #followfirday - I did not get a chance to do my yesterday 
0,where's tobunobuta? he promised that he'd go to LIA galaxy this afternoon and meet me but i couldn't find him 
0,so tired. Yet my body wakes up at 8am. Cant sleep in if i wanted!  
0,@GIANT_HOGWEED Raining and windy as hell here too - What happened to summer 
0,@simonPARASITE getting sick and tired of certain people.........Am I one of those?  
0,on my way to orlando...... really tired 
0,misses by blockmates already.  http://plurk.com/p/yv1zr
0,I wanna sleep until noon again. Being a working adult has ruined my ability to sleep in 
0,"I miss my LOVE  I want him home. It's Saturday! Blah, stupid work!"
0,@somanshu03 We too are looking forward to the game! Hope its not a washout  #wct20
0,@GHmltn nope 
0,"@tamiemaria just staying home, eating ice cream and watching movies  and you sweetheart?"
0,Last show of the year! What am I going to do now? Get ready for the post-show blues  It was AWESOME! Wish it didn't have to end. 
0,is sooo cold in this freezing night! adelaide u boring city! missing the boyfriend all so much 
0,No one showed up at 8 AM. Guess I'm going tubing by myself. 
0,@scarletshivers Yeah I had to run to the interview  Poo. I was really happy to see you two again! 
0,Working with my mum today..it's raining 
0,@BFHeroes Why did you skipped step 2  now its gonna take longer that expectet .
0,BLAHH trying to do History study but it isn't going too well 
0,@herbalicious poor amy  hun.. Did u ever check out the books? IMHO I think the shows WAY better.. No terra mae in the book ..luvs her
0,"@lemurcat47  yeah, bad for continuity, but I still enjoyed it. I like to think the original timeline is still going."
0,We just started our first &quot;batch&quot; of dialysate with the new PureFlow system. Can't use it because it hasn't been tested through the lab. 
0,@jumeee omg why??!  no more puppy??
0,at work. 
0,Omg I am so tired I hate work 
0,"@ollieisatwit i agree they're normally crappy, but my one is actually quite nice - 3&quot; diagonal with gestures. it's wearing down though "
0,@daveg38 yes 
0,Thursday's 3 fold increase in visitors to my site was so out of the norm that it has really skewed my sites stats 
0,"soooooooooooooo tired. i want more sleep, please. "
0,@steph_davies Vote now! I'm not in the top 20 anymore! 
0,"aah, why cant freo win any games "
0,"....Not available for the ceilidh however, soz @dizzyunplugged, cannot muster enthusiasjm "
0,"@Nettofabulous Headache? Really? Weather related? Weather sucks here, too. Very overcast "
0,BBQ been called off at the brother in laws  so I have nothing else left to do but level my Mage or do dailies. It's a hard life
0,"So glorious sunshine and BBQs last weekend, and grey skies, rain and hailstones this weekend "
0,Ow ow ow  Just hurt my hand again :'(
0,feel sick (N) and annoyed (N) but mason musso's voice is getting me through. XD the rain has given me a cold 
0,Jimmy? Then where is castiel?  wil have to wait til sunday to find out what is going on?
0,@philcampbell  still no Kindle in the UK 
0,my brother told me that im insomniac.NOOOO! I guess im really back to my old january self 
0,I wanna go home! 
0,i dont even want to go and fetch my lunch. its cold and raining and walking round town does NOT seem like my idea of fun!   x
0,"this is my 100th twitter. sorry, i dont have anything awesome to say "
0,@nenalyzed another day another day without hearing from u   only 1 more day till i sign off for 5 months. xoxo Trick
0,@Swidgie @Pepper_10 @diggrbiii Thank you folks! Moochie is still looking for Pearse.    I am thinking they played a lot when I was working
0,want a chocolate frappichino 
0,work work work work work Fun 
0,@Jetlagjen loved walkers marmite - dont make them any more 
0,@coollike Hey how much friends have you got on Xbox cause your friends list is full it would not let me add you. 
0,I'm leaving for Pittsburgh  My cousins and me are making birthday cards for Kyle and Kord and Hannah
0,"Good night out last night, now back to work "
0,@bkmacdaddy @bkmacdaddy   - I'm sorry!  But that's the TRUTH put yesterday behind and accept the promise of a new day!
0,everyone is going to oasis but me 
0,@thcasper haha neither do I!! like no idea!! im useless! 
0,i hit a bird with my truck on the way to work today 
0,is sat in Jess' cold 
0,@Lottiotta Sadly one of my heathers went kapute cos it's not alkaline soil  Note to self: buy litmus paper (how old skool(
0,"Its so crap. My day off and I was rudely awaken by a team of builders, plumbers, electircians at 6.30AM! I've spent all day unpacking "
0,twitter api is maintaining  Tất cả các app gỿi api twitter đỿu bị fail tron.. http://tinyurl.com/r5onuf
0,its so cold  i miss summer &amp; the sunburnt-ness.
0,@RockrFilms Yo savannh! What's up? Do you like sims 3? Cuz I don't like any sims! I just don't! 
0,@DT100 no toilets either now as I found out to my cost 
0,@markchute i did i sent u DM but u didnt reply 
0,it's raining  weather 2day really sucks... just cant stand it. it's so cold &amp; humid  lookin outside the window &amp; all i see -&gt; RAINDROPS!
0,My brother KJB199215 is really annoying me 
0,me for the win. nahh. that fails. 
0,"@PunkyStyle oh no!  sorry to read that, so sad."
0,work alll day! bad night last night 
0,@AceMas21 whats wrong ? 
0,Sitting at the reception desk at 8am on a Saturday. Not fun 
0,(@JohnnyTyson) @Lottiotta Sadly one of my heathers went kapute cos it's not alkaline soil  Note to self: buy litmus paper (how old skool(
0,Walking all day in high heels is no joke! I guess I'm still not used to it  Can't even walk to cwb from wan chai xx
0,"have hurt my shoulder and neck, on one side can only turn my head one way!!!    x"
0,"Photo: And so did Anthony! Others had it too, but they were taken out already so no pictures.  http://tumblr.com/xro1yt31f"
0,i am cold 
0,"is heading off from New Brunswick back to Salem, MA and the real world "
0,One game done already and I'm freezing  Just started the serious shit cricket 
0,More lemsip - chicken soup (yay!) - blurrgh!   
0,it's no fun mocking him now 
0,@meagansdesigns you just can't type anymore. very aggrevating especially if you are in the middle of a convo. Makes you look rude 
0,@belladonna20  to all good things comes an end .. But you can look back at the good times you had with them  ((hugs))
0,@benrlr Argh not very good it kept me up most of the night!  Probably my own fault for being on the computer haha! but oh well the chats..
0,"Ok, so my first yoga sock is almost done... but I tried it on &amp; it's definitely TOO BIG. Booooo. I like my socks more fitted than that. "
0,is working 
0,Wishing that I had the day off!  Instead I'm working both jobs on a beautiful saturday.  
0,Upset!  i no he doesnt know me but he doesnt have to be meen! and if he thinks im obsessed NO! im not!
0,Loong weekend! No sleeping in and I'll be on the go the whole time! Maybe take a nap Sunday afternoon after Adams party  busy busy
0,frick frick frickin youtube gotta go now peoples bye 
0,"dzien dobry! I just burned myself on the toaster, buuhuuu  It hurts haha!"
0,Off to work I have to go 
0,@yahmonkey NOT GOOD. NOT GOOD AT ALL.  I hate when that happens.
0,"@JessicaShumaker If this is the land of reasonable humidity, I don't think I ever want to experience Florida. "
0,@nickbernstein My ignorance is showing. I have not heard of either of those two worthies. 
0,baaad sore throat 
0,CAN SOMEBODY EXPLAIN WHY IT HAS BEEN RAINING ON AND OFF FOR TWO MONTHS?!?!?! sroqhwfkjdjfkrloqhhdfkifeoig   . Absolutely absurd!
0,"@Ariatina14 yeah unfortunately, lol, quite far up North. I'm going to have to stay7hrs at Terminal 4 waiting for a 7am flight to Oslo "
0,@GHmltn Dunno really..cant explain why I feel down....just do today 
0,@caffeinebomb is it full of seriously orange tantasic fashion victims? 
0,p: &gt;&gt;447139  report the other one?
0,@GrahamGudgin exactly and now many cds come in cardboard sleeves so not even reduced liner notes  #nostalgia
0,Will Barton to Memphis?    http://sbnation.com/e/664846
0,http://twitpic.com/6qlf8 - My little guy I miss him so much 
0,"Just when I think the universe is giving me a break, it trips me and laughs in my face... "
0,studying 4 social studies about ancient china and iran... 
0,@jeorgina weather is cold here in glasgow too  where is summer?
0,"on my way to a roseville, mn corporate sprint store... hope im not to late for a pre "
0,I'm up early bcuz i miss my kids...they're with their aunty having fun i'm sure but i always miss them when they're away. 
0,@ancoreny No! I was not happy when I found out about the key mark 
0,"@Dobbinone Well, if I wasn't being a scaredy cat I'd offer to take a pic for you!  Sorry "
0,@jeorgina Can relate to that.  It's raining and I've just sifted through the coding problems. *phew*
0,oh man..my girl days just started   damn!
0,is so sick that she can't barely stand 
0,Yes! School is ovr! I kinda wish I could go back though   I am moving to a new school nxt year so I probably wont c any of my old friends.
0,why have my children never learnt that they can sleep in (past 6.30am) on a Saturday? 
0,@Tarrrahh i was yelling -shiftyeyes- and my family already thinks im quite weird  and if i yelled i would interupt my parents movie 
0,no 1 wants 2 listen 2 me 
0,Wishing Maxwell would stop in Chi-town. Miss him terribly. 
0,Why do I have no followers??  
0,Hummph..  didn't win anything
0,"@annabadtzmaru its reggeaton, look them up LOL and no i dont think pitbull will be there  ahhahah or vin! (sorry)"
0,"@RyanMarkel Well, this won't make you feel any better, but I haven't slept past 6:30 since my first child was born....nineteen years ago. "
0,2nd day of summer. I havent gotten to sleep in yet. 
0,please. Someone work for me.  shelby 
0,@blondie_4414 &quot;Change u can believe in&quot; Only ever applied to those he had brainwashed  #wearescrewed #tcot
0,my room is such a mess i better tidy it today 
0,Boo. I am sooo sick. Head cold. 
0,&quot;twitter with friends&quot; + feedburner + google reader = not good enough  missing too many twits and showing them too late ...
0,"@sherinamunaf yeah,it's not cool being tall "
0,In mcdonalds  eight hours to go.
0,ahh!! been up since 3...so messed up. hate jet lag... who doesn't 
0,Got up early and fight with the pillow  I didn't wanna wake up booo I'm still sleepy... having breakfast
0,last day of shooting. oh god my stomach is aching 
0,what a drag i gotta go to a  wedding shower on such a nice day. So not looking forward to it 
0,"@NaughtyLab Awww, you can snuggle with my Sal, she's frightened of  it too. Is lookin very scared. "
0,@_CrC_  Hey Chris cant wait to see you tonight I am on my way too!!! NO 5*  Come out at the buses please B there around 11-12 amie xoxo
0,Playing Mafia Wars beta! Feel like crap 
0,that will be the Alan Sugar school of education then? Anticipate slashes to budgets for all but skills 
0,Arm is still messed up.  
0,@SweetIsa I've been up way too long too .. Weekends I'm on wake-up duty 
0,"has some argues with his damn conscience about a certain happenings lately... it's a tuff discussion, folks! I might not get trough it.. "
0,Just cooking bacon sandwiches for &quot;brunch&quot;. Although no brown sauce to go with 
0,"@morgane_d oh man,I'm sooo jealous.i wanna see them too  greetz my man from me xD"
0,"@kishorcariappa with all those widgets on the n97, and all that you are gonna install later on, it is slow  .. i can run win95 on my n95"
0,Hummph..  didn't win anything at khelo jeeto jiyo... Got eliminated in buzzer round
0,@infobunny you've never been interested in the face bit of me  I'm just a huge throbbing Pleasure Pole for you aren't I?
0,"@noxhanti Hiya,? Ididn't know that yes i'm good but I think I will off next week, I'm really sad "
0,This back pain is killing me 
0,I want a pair of Greedy Genius High :| I want it badly.  http://bit.ly/UIi3r
0,"@CrisiLouise m good, got go get stuff for lunch, this morn has been a washout, not much sleep cos Art is ill "
0,is pissed off she's not going 2 the Isle of Wight 
0,My sim is hopeless at cooking! I have already had a fire and keep burning my breakfast 
0,"Noo!  @tanilolli is beating me in the race for 1,000 followers.  "
0,wishes she had a long straw so she didn't have to lift her head 
0,wow just woke up to crazy pain. I hope this vicodin lasts me. 
0,Wishing I had a feet therapy because pretty heels killed my feet 
0,is pissed off she's not going 2 the Isle of Wight  lol
0,too bad i wasn't out there with em chasing  
0,"Tired, so tired...listening to the Unbelievable Truth. Good times. Nothing to do today, would play golf but the weather is crap "
0,"Eurgh the weather i awful :\ Its like pouring down with rain, Where did the sunshine go "
0,Getting ready for H.Wilcox's funeral  Then I have to work tonight... talk about being exhausted!
0,have looked to Superhero Movie the second time-it's gonna be boring when you looked it twice 
0,Benn depressed had a very very bad day  
0,now in Melaka doing environmental research. The number of turtle is declining in Padang Kemunting Turtle Management Centre. 
0,youtube keeps signing me out ahhh :@ all i wana do is upload a video 
0,@hintswen me too! It's not mine 
0,@hahaha well you not here to cook  what am i supposed to do 
0,@Lesley_M awww poor u  Finally catching up on celeb appretice
0,Waiting for the guests to leave!! ...I need a Qatari national for a sponsor i think ...poopsicles! 
0,Lunchtime! ...at work 
0,my legs hurt. 
0,mourning....My next door neighbour died last nite  (R.I.P)
0,@chrisholder1 
0,wants more sleep  8am I hate you!
0,@mjleenvoice yah lor. now i everyday will take time to check her body for new ticks. after grooming then i bring her go vet. 
0,So i lied. I'm sorry..random stranger. I don't mean it. Really really sorry 
0,@serenitymeimei lmfao omg person! I would freaking die from teh hot if she did... i heard they hocked a &quot;real&quot; one at the auction 
0,"by the way, i thought id be able to get all your twitters sent to my italy phone but it wont work "
0,"bad weather, oxfam at 2 "
0,Taking the sats  ugh
0,Of course my throat hurts 
0,"Watching &quot;The Wind That Shakes The Barley&quot;, god it's so depressing "
0,Show cancelled today  But that means more fun wit my partner in crime! 
0,"@Kate_Antistar - oh no! that sucks, but I am still annoyed because I bought the top from a UK store! it's crazy.. damn post "
0,"@BlackenAmbaa Someone reversed into me in a car-park in Bristol they shouted abuse at me, scruffle &gt; Court "
0,@kaza86 ha ha ha ha well you not here to cook  what am i supposed to do 
0,woo got back from n amezin radio show fuled by 5 cups of coffee but its rainin 
0,"@Britt7094 Oh, that's sad  Bad dog"
0,@JonathanRKnight you wont escape the rain when you head to Perth Australia in Aug it's cold and raining here to 
0,"@EmmaDavisTri Probably true, but unfortunately for me I am not doing that weird stuff anymore "
0,Lions just lost by 6 points 
0,Lions just lost by 6 points  http://ff.im/-3EBjk
0,"Hunger, pain, hunger, pain ... pain and pain.   Someone is there morphine?"
0,mau the sims 3 
0,"Lost the toss, we're fielding. Gonna be a long afternoon "
0,@petedonaldson you can't do that!!! Get a girls hopes up and all that just to have them plummet into an abyss  *Grrrr* 
0,Wanna eat dim sum 
0,"@MaverickNY yes, it was sad but inevitable I am afraid "
0,thank you AVG scan for slowing my pc so effing much! also lost my voice &gt;.&lt;  going back to bed...
0,Weekend class....All day 
0,On my way to buy a blackberry now! By y do friends always let me down? 
0,@kitkat_l ME! I want to  No tickets 
0,What are these outfits???!!!! What have I gotten myself into 
0,@HipMom As of now I'm not  going  to blogher ! Where is the picnic?
0,Well this isn't so bad as I thaught- but neither of my faveorite managers are here... 
0,damn fake eyelash glue...making my eyelids stick together... 
0, don't wanna go to work
0,@c0v89  @goodbyecaptain It's been gone for ages 
0,"Thinks he will pop into town then make some brownies, shame about the weather though "
0,I lost my kitty cat. 
0,Not sleeping really wreaks havoc on the body. 
0,"Discovering the world, 10 days a year. Americans do get very few holidays a year!  http://bit.ly/18bAhC"
0,i miss my ex. 
0,think i just changed my pic thing? but whenever i post comments to people it doesnt show it  confused! lol
0,@XmcflyMCRX haha that's a cool way to spend a weekend! oh and y r u sad?? 
0,@chrisilluminati Ended up not seeing it. Had to be back home cause babysitter (my parents) could only watch kids till 10. 
0,working 1030am-1030/11pm. Made even longer by the fact that I have to depend on my brother for a ride home...I miss my car   ugh Text Me!
0,We are leaving tomorow  #DSAA09
0,I think I have 5 mins to talk until I have to get sons BB stuff in the wash. HI ALL!! lol I miss Twittering 
0,"@Hannah182 Didnt go in th end mike wasnt gona b there til 6 &amp; i had to leave @ 9. I hate bein here now, i want pmouth and friends back! "
0,argh i can do like nothing today cos of all my coursework :| i was asked to the lakes and the cinema and can't go 
0,@EvilNanny LOL well I'm up there with you I was on the naughty step 3 times yesterday!!  
0,ahhhh i need to clean my room.... bad times 
0,is cold and its raining 
0,Hmm.. someone just sent me this phisher email to my student account.. asking for name/password..social engineering never ends it seems.. 
0,"up &amp; at 'em, taking shawna to the airport. no gas stations open @ 5am "
0,@zoelovesyouuu so do I  us rocking out with miley would have been epic :b
0,Fucking tonsilitus ! Mardy bum now 
0,going to work. on a saturday. 
0,"Personal care time, then to meet a dear friend, then back to work again! "
0,"5 30am, the suns coming up. And im still wide awake "
0,I wish I had the Sims 3 
0,Will Barton to Memphis?  
0,Why isn't anyone updating 
0,@jordanswanson ZOMG! i want waffles 
0,is still ill 
0,so who was at rocky last night? i totally missed out  saw the hangover. best movie ever.
0,There is definitely a sense of pathetic fallacy today. Stupid weather 
0,So confused 
0,Its like u people don't care 
0,@xzashley I miss you. 
0,what about me?? 
0,theirs a hole in my foot. Ouch.  http://twitpic.com/6qlmy
0,"Remember the accident where a truck ploughed into me, when they tripled my insurance until it was settled? Now it is and its still double "
0,At starbucks on my way to work  its just to early to be at work on saturday
0,"@_CrC_ still at the hotel in VA, will be flying out to Camden to see ya fellas-we were at ATL, VA &amp; Camden will be our last show "
0,@ronnyvengeance I would if I didnt live so far away from you 
0,"I wish I had a smartphone so I could check my twitter page at work. now I can only post, I can't read anything. "
0,@MzFuller8  I hope you start feeling better....
0,@gins_tonic  ahh... so thats what you've been doing in your room all evening.... leaving me all alone in the lounge 
0,@VickiGarlick It is.  I'm starting to get sick with worry.  
0,@xShefSx good luck for when u get to five. its a right bitch  
0,okay seriously now guys. i cant move my mouth. at all. SERIOUSLY DONT HAVE A OPERATION ON YOUR MOUTH im in so much pain .. cheer me up  x
0,"ever since @fakerubens drew me that picture, things just haven't been quite the same. "
0,Why do I always wake up early on weekends?  Sleeping in occasionally would be nice. 
0,@sarahlovesmicky DIVA no work on ipod  and neither does AH not cool.
0,this is not the restfulll saturday I was hoping for. Got only 30 minutes to read. 
0,Yay! Birthday partiess rock...but I can't help thinking bout my mom... 
0,OFF 2 THA GYM..I HAV BOOT CAMP 2DAY!! PRAY 4 ME 
0,"@johncmayer Damn, I wish I would have done that, instead of dropping $150 on that hooker last weekend. "
0,"Weird laying in bed and loui's not here, or around the house.  :/   "
0,"I have a craving for a chocolate muffin, don't have any. I had a nightmare that I walked in on my boyfriend shagging my cousin last night "
0,Gaz is being such a little bitch  Attempt two at the haircut.
0,"Poring rain today, no gardening for me "
0,@jonasnessica I couldn't agree more! But haters will always hate 
0,"So much for the Ferrari resurgence, Red Bull and Brawn on front row.  #f1"
0,In a cab on the way home from lions. Lost.  http://myloc.me/2MHX
0,"time for a shower, then to bed. hopefully insomnia won't set in. out of zanax "
0,I hate running late 4 work! No time to stop for my diet dr pepper this am 
0,@pixiesongs  i loved you in Dundee  I want you to come back !. You rocked we loved you.
0, ih had 110 followers and now ih hav 99 heyyy twitter
0,@emilysarah2303 eeek just had cornflakes without thinking!!!! Stupid nut based cereal! 
0,@SpecialDewi Very. And I bought new shorts as well. 
0,@AnG_CaKe i dont have a choice man. there'll be no dancing fo another week and a half 
0,@davidhardie kinda sad how that all works out... Once they are all out of their bubble 
0,i feel sick now 
0,i think i have cough problems because ive been coughing like a cold cough since end of april 
0,Just got back from gym class and it is now confirmed I have no control over the left side of my body  Time to swat up for interviews now.
0,"Orange and Mango juice is lushhh !! I want to go out tonight, but i can't  boohoo."
0,Have U Seen The Weather?? o_O Its Very Very WET!!! Stupid Irish Weather...Wheres The Sun Gone?? 
0,on the 20th june i would of had like 9 exams in 2 months  not very good at all. and i hate math!
0,"@jmccray Work, Work, Work    U?"
0,"@Woo100  Oh no! We love Margaret, won't be the same without her "
0,@ParamoreInOz yeah i check daily! It sucks i really wanna see them! 
0,Can't believe I woke up 6 a.m for nothing  My classes are ACTUALLY going to start later lol ;) f-it.
0,living in the Norwich in the UK has taught me there is no room in this world for me i would love to have been accepted 
0,"GOT DUTY TODAY, BORED ON THE SHIP TILL TOMORROW MORNING.. "
0,going now to haul Beau to the vet. it's too early for this 
0, last night I fell while I was taking the trash out... I really hurt my arm but now I am feeling better..need to study really soon!
0,still have a headache... 
0,@ddlovato I don't like the people who keep talking bad about others 
0,@Tbishh poor thing 
0,@Uk_joedan_fan Hey. Who got DM from jon saying no return to UK? That's not good. 
0,omg margaret is leaving the apprentice! 
0,"@Draggyish Grrr, it didnt take that long for me to DL!  silly Sony!"
0,just back from my 15km walk-dam legs aint what they used to be 
0,@seanmadi I've been waking up at 5:30am the last few days. I couldn't wake up at 10am for school. It doesn't make sense 
0,My friend just gave me scary news-sad world we live in! Stay prayed up &amp; ask God 2 cover u in the blood EACH &amp; EVERY time u venture out 
0,"only just woke up, and it's raining  oh well, hopefully sammy will chill with me later!"
0,@kimiecat - The strawberry plants grow ok but I can't get them to fruit much.  The did briefly but the snails got to 'em before  could 
0,"Dear god! the wait is unbearable, ever purchase old games, but its dead online except for that one match that never ever starts! "
0,@dubedition209 Yah i tried that but OSX doesn't see the partition. 
0,And yet shes so hard to ignore..  
0,just watched the bit where @Michael_Castro 's whole room went home  GRRR!
0,I miss my bed and my pillows... 
0,@JoeyMacsgirl mate got a DM from jon to say that they not coming back this way.joe says in i/view they &quot;wrapping it up&quot; after oz 
0,@daibarnes and guess who's landed that plum job? Moi  were hosting big conf on July 1st and sen dep head wants them for then 
0,Im realy Sik 
0,"The good news is that I get to go back to sleep, the bad news is that I don't get to work today. "
0,"have to sneeze the whole time  think I'm getting a cold  and it's raining, where is the sun?? can't find it!"
0,@dv0rsky what a pity! it was a bit sad having live examples from Ukraine and Serbia and ordinary bla-bla from Georgian journalist 
0,My gran has died  - goin to see the family
0,@banksismusic  me too! Is that our jobs??? Fuck!!! it is our jobs! U know the rest!
0,@Maestro meeee unfortunately  damn all that Red Bull I drank earlier!!!!
0,dang its raining out which means no paraid that sucks i was looking forward to taking the boys. 
0,@Sinium why is it that we wake up so early now that were out of school? Wtf 
0,@hungluu sign on the door 'closed for good' booo  Hangover-many @hungluu lifestyle references nicely portrayed...good times.
